{
  "id": "ref-proposal-storage-independent-contract",
  "type": "proposal",
  "schema_version": 1,
  "created_at": "2026-09-10T00:00:00Z",
  "state": "published",
  "content": {
    "title": "Keep canonical meaning independent of persistence",
    "summary": "Define and test portable canonical records before binding them to a database implementation.",
    "body": "Phase 2 persistence should ingest and reproduce portable records without requiring D1-specific row identity, triggers, schema quirks, or hidden application state to recover institutional meaning."
  },
  "relationships": [
    {
      "type": "supports",
      "target_ref": "ref-contribution-origin-neutral"
    }
  ],
  "provenance": {
    "source_ref": "docs/decisions/0012-reference-corpus-before-persistence.md",
    "kind": "reference_fixture"
  }
}
