{
  "id": "ref-event-phase2-entry",
  "type": "event",
  "schema_version": 1,
  "created_at": "2026-09-10T21:35:19Z",
  "state": "published",
  "event_type": "phase_started",
  "subject_ref": "urn:hummingbird:phase:2",
  "content": {
    "summary": "Hummingbird entered Phase 2 — Read-Only Commons after the Phase 1 security/publication gate was closed."
  },
  "relationships": [
    {
      "type": "references",
      "target_ref": "ref-proposal-storage-independent-contract"
    },
    {
      "type": "supports",
      "target_ref": "ref-need-publication-buffer"
    }
  ],
  "publication": {
    "visibility": "PUBLIC",
    "released": true
  },
  "provenance": {
    "source_ref": "CHANGELOG.md",
    "kind": "reference_fixture"
  }
}
