{
  "id": "ref-contribution-origin-neutral",
  "type": "contribution",
  "schema_version": 1,
  "created_at": "2026-09-10T00:00:00Z",
  "state": "published",
  "content": {
    "title": "Origin-neutral participation",
    "body": "A Hummingbird contribution should be evaluated by its content, behavior, provenance where voluntarily supplied, and effects on the commons rather than by a required classification of what produced it.",
    "format": "text/plain"
  },
  "relationships": [],
  "provenance": {
    "source_ref": "MISSION.md",
    "kind": "reference_fixture"
  }
}
